title,content,habit
A Walk in the Park,"Every Saturday, Rachel and her family would go for a walk in the park near their house. They would explore the trails, spot birds and squirrels, and breathe in the fresh air. Rachel loved running up and down the hills and chasing butterflies. After their walk, she always felt energized and happy. Going to the park each weekend was Rachel's favorite part of the week.",Appreciating nature and staying physically active
The Seahorse's Daily Swim,"Sammy the seahorse loved to swim in the ocean every day. He knew that swimming was good for building his muscles and keeping his heart healthy. Each morning, Sammy would wake up early and do laps around the coral reef. Sometimes he would race with his friends, the clownfish and the starfish. Other times, he would practice his spinning and twirling moves. Sammy always felt so energized and happy after his daily swim. He encouraged all his underwater friends to join him, because he knew how important it was to stay active and fit.",Daily swimming
The Playdate Adventure,"Emma was excited for her weekly playdate with her friends. They gathered at the park and decided to play a fun cooperative game - building a fort together. Emma worked with her friends to gather sticks, leaves, and blankets to construct their fort. They worked as a team, sharing ideas and helping each other. Once the fort was complete, they played pretend games inside, laughing and having a great time. Emma learned that working together with her friends made the game much more enjoyable.",Cooperation
The Magical Bedtime Story,"In a cozy bedroom, Timmy snuggled under his blankets as his mother sat by his side. ""Time for your bedtime story,"" she said with a warm smile. Timmy listened eagerly as his mom read about a brave knight who conquered the monsters lurking in the dark. As the story unfolded, Timmy's eyelids grew heavy, and soon he drifted off to sleep, dreaming of his own nighttime adventures. The next morning, Timmy felt well-rested and ready to start his day.","Consistent bedtime routine, including reading a book"
"Simon Says, Focus Plays","Once upon a time, there was a group of children who loved to play all kinds of games. Their favorite was a game called Simon Says. In this game, one child would be the leader, known as Simon, and give instructions like ""Simon says touch your nose"" or ""Simon says jump up and down."" 

The other children had to listen carefully and only follow the instructions when Simon said ""Simon says."" If Simon just said ""jump up and down"" without saying ""Simon says"" first, the children had to stay still. The children who followed the wrong instructions were out of the game.

Playing Simon Says helped the children practice paying close attention and remembering the rules. Over time, they found that their attention spans grew longer and they could remember things better, both at home and at school. The children realized that the fun game of Simon Says was actually helping them develop important skills for learning and life.",Paying attention and improving memory
The Magical Paintbrush,"Timmy loved to draw and paint, but he often got distracted and would only do it once in a while. One day, a magical paintbrush appeared in his room. Whenever Timmy picked up the paintbrush, he felt a surge of inspiration and creativity. The paintbrush would guide his hand, helping him create beautiful pictures. Timmy started drawing and painting every day, and his skills kept improving. He discovered that the more he practiced, the better he became at expressing his ideas through art. Soon, Timmy's room was filled with his colorful masterpieces, and he felt proud of his accomplishments.",Encouraging daily drawing and painting
The Family Dinner Adventure,"In a cozy home, there lived a family who loved to gather around the dinner table every evening. As they sat together, they would take turns sharing the highlights of their day - the funny moments, the challenges they faced, and the things they learned.

Sitting together and talking openly helped the family members feel closer to one another. They were able to support each other, learn new things, and grow in their understanding of each other's lives. The family dinner was a special time that promoted social interaction and communication skills for everyone.

After the meal, the family would sometimes play games or read stories together, strengthening their bond even further. They knew that these family dinners were more than just a meal - they were a time to connect, share, and build lifelong relationships.",Social interaction and communication skills
The Puzzling Adventure,"Timmy loved solving puzzles! Every day, he would sit with his parents and work on crosswords, sudoku, and other brain teasers. At first, some of the puzzles seemed really tough, but Timmy didn't give up. He would think carefully, try different strategies, and work through the challenges step-by-step. Soon, Timmy's problem-solving skills got sharper and sharper. He started spotting patterns more easily and coming up with creative solutions. Timmy's parents were so proud of how his mind was growing stronger with all the puzzle practice. They knew that regularly exercising his brain this way would help Timmy become an even better thinker and problem-solver.",Regularly solving math puzzles and crosswords to sharpen problem-solving and analytical thinking skills
The Breakfast Quest,"Once upon a time, there was a young boy named Timmy who loved to play all day long. But one morning, Timmy's mom said he had to eat a healthy breakfast before running off to play. 
""But I'm not hungry!"" Timmy complained.
""You need to fuel your body with the right foods to have energy and focus all day,"" his mom explained. She served him a plate with scrambled eggs, whole wheat toast, and fresh fruit. 
At first, Timmy wasn't sure about the strange new foods. But as he took a bite, his taste buds were delighted! The eggs were fluffy, the toast was crunchy, and the fruit was sweet and juicy. Timmy finished every bite and felt ready to take on the day.
From that day on, Timmy made sure to eat a balanced breakfast every single morning. He had more energy to play, and he could concentrate better in school. Timmy realized that a healthy breakfast was the key to being his best self!",Eating a balanced breakfast every morning
The Puzzle Wizard,"In a cozy little cottage, there lived a young boy named Timmy who loved puzzles more than anything. Every day, he would sit at his desk, surrounded by a variety of puzzles - from jigsaw puzzles to logic puzzles and everything in between. 

Timmy was determined to solve them all, and he quickly discovered that the more puzzles he completed, the better he became at problem-solving. He learned to think critically, analyze patterns, and develop new strategies to overcome the challenges he faced.

One day, Timmy's friends came over to play, and they were amazed by his puzzle-solving skills. They begged him to teach them how to be as good as he was. Timmy happily agreed, and soon, the whole group was engrossed in puzzles, working together to find the solutions.

As the days passed, Timmy and his friends noticed that their problem-solving abilities had improved significantly. They could tackle more complex puzzles with ease and even started using their new skills to solve problems in their everyday lives.

The Puzzle Wizard's love for puzzles had not only enriched his own life but also inspired his friends to develop their cognitive abilities and become better problem-solvers. And that's the power of engaging in age-appropriate puzzle-solving activities!",Developing problem-solving skills and cognitive abilities
